,Unnamed: 0,_unit_id,_golden,_unit_state_x,_trusted_judgments,_last_judgment_at_x,violence_judgment,violence,violence_confidence,protest_judgment_x,protest,protest_confidence,created_at,id,proccd_text,clean_text,non_vio_prob,vio_prob,violence_prediction275,612,1657978935,FALSE,finalized,3,4/23/2018 09:37:26,"""111""",1,1,"""111""",1,1,Sat Jun 01 01:24:31 +0000 2013,3.41E+17,rt usrId police attacked a nearby military barracks to stop soldiers helping the httpAddress #occupygezi #direngezipark usrId usrId,police attacked nearby military barracks stop soldiers helping,0.538436026,0.461563974,1276,613,1657978937,FALSE,finalized,3,04/03/18 18:33,"""100""",0,0.6748,"""111""",1,1,Wed Jun 05 23:08:22 +0000 2013,3.42E+17,rt usrId turkey protester dresses up as police after stealing helmet shield and baton from security forces by umit bektas httpAddress,protester dresses police stealing helmet shield baton security forces umit bektas,0.848482593,0.151517407,0277,616,1657978942,FALSE,finalized,3,04/03/18 21:20,"""0""",0,0,"""010""",0,0.6684,Mon Jun 10 11:04:04 +0000 2013,3.44E+17,rpt moody s says turkey s credit risk to rise if protests go on httpAddress,rpt moody says credit risk rise go,0.943243365,0.056756635,0279,620,1657978950,FALSE,finalized,3,04/06/18 13:01,"""100""",0,0.6639,"""111""",1,1,Thu Jun 13 13:50:47 +0000 2013,3.45E+17,rt usrId announcement in gezi the police are getting ready put on your masks httpAddress #occupygezi,announcement police getting ready put masks,0.703211613,0.296788387,0280,622,1657978952,FALSE,finalized,3,04/03/18 18:58,"""000""",0,1,"""111""",1,1,Sat Jun 15 09:24:22 +0000 2013,3.46E+17,dtn world news turkish protesters vow to stay put turkish protesters vow to continue occupying istanbul s httpAddress httpAddress,dtn world news vow stay put vow continue occupying,0.982054297,0.017945703,0281,624,1657978955,FALSE,finalized,3,04/06/18 15:06,"""0""",0,0,"""010""",0,0.6639,Thu Jun 06 03:56:25 +0000 2013,3.42E+17,rt usrId the DD most epic photos from turkey s protests so far httpAddress,epic photos far,0.755059366,0.244940634,0282,626,1657978959,FALSE,finalized,3,04/04/18 08:50,"""00""",0,0.6684,"""011""",1,0.6684,Sun Jun 02 06:08:34 +0000 2013,3.41E+17,rt usrId erdogan for every 100 00 protesters i will bring out a million from my party httpAddress lol he sounds like m,erdogan every bring million party lol sounds like,0.972108364,0.027891636,0283,627,1657978961,FALSE,finalized,3,04/06/18 12:00,"""000""",0,1,"""111""",1,1,Mon Jun 17 15:29:27 +0000 2013,3.47E+17,rt usrId taken by a friend in tunel httpAddress god theboy noticed barely in time startedrunning amp ,taken friend tunel god theboy noticed barely time startedrunning,0.986536819,0.013463181,0284,628,1657978962,FALSE,finalized,3,04/07/18 17:12,"""nan""",0,0,"""000""",0,1,Sat Jun 01 20:04:41 +0000 2013,3.41E+17,so true rt aliabunimah suddenly a lot of turkey experts on twitter !,true aliabunimah suddenly lot experts twitter,0.960095447,0.039904553,0285,629,1657978963,FALSE,finalized,3,4/18/2018 05:38:29,"""nan""",0,0,"""000""",0,1,Mon Jun 03 13:22:50 +0000 2013,3.42E+17,#turkey is scary for #mb because it shows that even if they do the unlikely amp ,scary mb shows even unlikely,0.948522129,0.051477871,0286,633,1657978968,FALSE,finalized,3,4/21/2018 17:56:14,"""00""",0,0.6609,"""011""",1,0.6609,Sat Jun 01 02:07:09 +0000 2013,3.41E+17,rt usrId 4 00am bosphorus httpAddress people crossing on foot to join #occupygezi via usrId httpAddress,bosphorus people crossing foot join via,0.938954812,0.061045188,0287,635,1657978973,FALSE,finalized,3,04/06/18 12:16,"""0""",0,0,"""010""",0,0.6639,Sat Jun 01 08:11:48 +0000 2013,3.41E+17,rt usrId usrId this is not a spring for turkey already has httpAddress but it needs a more liberal and participatory,spring already needs liberal participatory,0.954495046,0.045504954,0288,636,1657978974,FALSE,finalized,3,04/06/18 15:00,"""111""",1,1,"""111""",1,1,Tue Jun 11 18:54:49 +0000 2013,3.45E+17,rt usrId police attacking #taksim #occupygezi #direngeziparki #istanbul #turkey 344528167492521985 tue jun DD 18 54 50 00 2013 belieber3b wait !! you ll come to turkey ?! d 344528176891957248 tue jun DD 18 54 53 00 2013 rt usrId photo clashes continue in #taksim square between turkish police and protesters httpAddress httpAddress jun DD 18 54 55 00 2013 in pictures turkish clashes police move in on protesters in taksim square httpAddress jun DD 18 54 58 00 2013 update #turkey httpAddress #direntaksim #occupygezi 344528205878804481 tue jun DD 18 54 59 00 2013 rt usrId as wind clears out gas demonstrators httpAddress its back and httpAddress #taksim #turkey httpAddress,police attacking belieber b wait come photo clashes continue square police pictures clashes police move square update direntaksim wind clears gas demonstrators back,9.58E-06,0.999990416,1289,637,1657978975,FALSE,finalized,3,04/03/18 21:51,"""nan""",0,0,"""000""",0,1,Fri Jun 14 13:41:41 +0000 2013,3.46E+17,usrId hey move those chicken wings turkey !,hey move chicken wings,0.954863922,0.045136078,0291,639,1657978978,FALSE,finalized,3,04/03/18 21:04,"""0""",0,0,"""001""",0,0.6757,Thu Jun 06 21:59:11 +0000 2013,3.43E+17,news by yahoo erdogan returns to face protests in turkey ankara turkey ap turkey s prime minister was httpAddress httpAddress,news yahoo erdogan returns face ankara ap prime minister,0.971093311,0.028906689,0292,640,1657978979,FALSE,finalized,3,04/03/18 19:37,"""000""",0,1,"""111""",1,1,Sat Jun 01 20:32:43 +0000 2013,3.41E+17,rt usrId a widely circulated photo from the protests in turkey is actually from a marathon httpAddress httpAddress,widely circulated photo actually marathon,0.878453569,0.121546431,0293,641,1657978980,FALSE,finalized,3,4/23/2018 09:30:58,"""000""",0,1,"""111""",1,1,Sat Jun 01 15:07:52 +0000 2013,3.41E+17,geez rt soipl my friend in #istanbul just sent me this image frm the #occupygezi httpAddress,geez soipl friend sent image frm,0.948522129,0.051477871,0294,643,1657978982,FALSE,finalized,3,04/04/18 09:19,"""00""",0,0.6658,"""110""",1,0.6658,Tue Jun 04 19:41:58 +0000 2013,3.42E+17,rt usrId the people of turkey are fighting for httpAddress read this report from usrId friend in taksim sq istanbul httpAddress,people fighting read report friend sq,0.938954812,0.061045188,0295,644,1657978986,FALSE,finalized,3,04/03/18 21:25,"""0""",0,0,"""100""",0,0.6594,Sun Jun 02 17:11:23 +0000 2013,3.41E+17,istanbul united since httpAddress #galatasaray #fenerbahce #besiktas #united #occupygezi #occupytaksim httpAddress,united since galatasaray fenerbahce besiktas united occupytaksim,0.931244564,0.068755436,0296,647,1657978995,FALSE,finalized,3,04/07/18 17:00,"""111""",1,1,"""111""",1,1,Sun Jun 16 13:49:56 +0000 2013,3.46E+17,police caught adding pepper spray chemicals to water in water cannons #occupygezi httpAddress #direnturkiye #occupyturkey #ows,police caught adding pepper spray chemicals water water cannons direnturkiye occupyturkey ows,0.437542436,0.562457564,1297,651,1657979003,FALSE,finalized,3,04/03/18 22:42,"""000""",0,1,"""111""",1,1,Sat Jun 22 16:36:23 +0000 2013,3.48E+17,rt usrId taksim httpAddress usrId usrId #direnankara #occupygezi #revolution #direngezi #killererdogan #turke htt,revolution direngezi killererdogan turke htt,0.88781865,0.11218135,0299,655,1657979009,FALSE,finalized,3,04/07/18 17:04,"""000""",0,1,"""111""",1,1,Sat Jun 15 14:08:35 +0000 2013,3.46E+17,rt usrId turkish protesters vow to continue occupying istanbul s gezi park despite the pm s pledge to halt redevelopment plan http,vow continue occupying despite pledge halt redevelopment plan,0.954121974,0.045878026,0300,656,1657979010,FALSE,finalized,3,04/07/18 17:14,"""nan""",0,0,"""000""",0,1,Mon Jun 10 20:22:21 +0000 2013,3.44E+17,having turkey mems with the fam can t believe it s been nearly a year miss it,mems fam believe nearly year miss,0.832315317,0.167684683,0301,660,1657979018,FALSE,finalized,3,04/03/18 22:42,"""111""",1,1,"""111""",1,1,Sat Jun 01 00:17:09 +0000 2013,3.41E+17,rt usrId #occupygezi protests turn violent as police attack peaceful protesters in istanbul httpAddress via usrId #,turn violent police attack peaceful via,0.24862824,0.75137176,1302,661,1657979020,FALSE,finalized,3,04/07/18 16:21,"""000""",0,1,"""111""",1,1,Thu Jun 13 19:11:09 +0000 2013,3.45E+17,#turkey live with avi at gezi park httpAddress u feel the humanism in the park and the terror and fear outside the park,live avi u feel humanism terror fear outside,0.9393191,0.0606809,0303,663,1657979022,FALSE,finalized,3,04/06/18 14:46,"""00""",0,0.6695,"""110""",1,0.6695,Tue Jun 04 12:07:01 +0000 2013,3.42E+17,my father told me when i was young riots are httpAddress it means httpAddress #occupygezi,father told young riots means,0.937532115,0.062467885,0304,664,1657979023,FALSE,finalized,3,4/21/2018 18:00:56,"""0""",0,0,"""001""",0,0.6783,Mon Jun 10 07:41:11 +0000 2013,3.44E+17,rt usrId why turkey s mainstream media chose to show penguins rather than protests kerem oktem httpAddress,mainstream media chose show penguins rather kerem oktem,0.952292308,0.047707692,0305,665,1657979026,FALSE,finalized,3,04/06/18 12:54,"""nan""",0,0,"""000""",0,1,Mon Jun 24 10:22:20 +0000 2013,3.49E+17,i ve come all the way to turkey and still i find myself in the same place as a fucking #reddawg,come way still find place fucking reddawg,0.948522129,0.051477871,0307,671,1657979040,FALSE,finalized,3,04/03/18 22:30,"""0-11""",0,0.336,"""111""",1,1,Sat Jun 15 20:51:04 +0000 2013,3.46E+17,rt usrId #erdogan s police is burning wish tree at #gezipark httpAddress but can t burn our hope #occupytree,erdogan police burning wish tree gezipark burn hope occupytree,0.947561464,0.052438536,0308,677,1657979050,FALSE,finalized,3,04/03/18 22:42,"""0""",0,0,"""100""",0,0.6631,Tue Jun 04 16:56:51 +0000 2013,3.42E+17,rt usrId white house calls for calm in turkey as protests rage on httpAddress,white house calls calm rage,0.948522129,0.051477871,0309,679,1657979056,FALSE,finalized,3,04/03/18 21:27,"""000""",0,1,"""111""",1,1,Sun Jun 23 19:45:32 +0000 2013,3.49E+17,#halktv candir #direngaziparki,halktv candir direngaziparki,0.948522129,0.051477871,0310,685,1657979068,FALSE,finalized,3,4/22/2018 12:54:24,"""nan""",0,0,"""000""",0,1,Tue Jun 25 20:58:18 +0000 2013,3.50E+17,the shit y all moms buy y all and keep in the httpAddress fucking turkey bacon ? y all niggas are httpAddress worst idea httpAddress,shit moms buy keep fucking bacon niggas worst idea,0.968685934,0.031314066,0311,686,1657979069,FALSE,finalized,3,04/06/18 14:46,"""nan""",0,0,"""000""",0,1,Sun Jun 16 23:07:02 +0000 2013,3.46E+17,usrId son i think i offended the whole of turkey mentions are in shambles lmaoo,son think offended whole mentions shambles lmaoo,0.913611556,0.086388444,0312,688,1657979074,FALSE,finalized,3,04/03/18 21:12,"""111""",1,1,"""111""",1,1,Sun Jun 16 11:27:32 +0000 2013,3.46E+17,rt usrId amnesty press release on #turkey police violence secret detentions arrest of doctors #direngeziparki #occupygezi http,amnesty press release police violence secret detentions arrest doctors,0.107200191,0.892799809,1313,691,1657979080,FALSE,finalized,3,4/22/2018 12:57:46,"""1""",0,0,"""001""",0,0.6783,Sat Jun 01 20:39:45 +0000 2013,3.41E+17,rt usrId cnn international correspondent usrId is covering the growing protests in httpAddress cnn turk showing music videos an,cnn international correspondent covering growing cnn turk showing music videos,0.976281374,0.023718626,0314,692,1657979081,FALSE,finalized,3,04/07/18 09:15,"""0""",0,0,"""001""",0,0.6648,Sat Jun 22 16:05:42 +0000 2013,3.48E+17,rt usrId sound of silence taksim square httpAddress,sound silence square,0.935195922,0.064804078,0315,694,1657979084,FALSE,finalized,3,4/22/2018 12:44:15,"""001""",0,0.6783,"""111""",1,1,Sun Jun 02 18:38:48 +0000 2013,3.41E+17,rt usrId good read but get s it wrong on the kurds muftah why the gezi park protests do not herald a turkish spring yet h,good read get wrong kurds muftah herald spring yet h,0.949093483,0.050906517,0316,695,1657979085,FALSE,finalized,3,4/22/2018 18:44:43,"""nan""",0,0,"""000""",0,1,Thu Jun 20 20:47:00 +0000 2013,3.48E+17,paul gnawing on a turkey leg at six httpAddress describing its taste he comments httpAddress httpAddress,paul gnawing leg six describing taste comments,0.948522129,0.051477871,0317,697,1657979088,FALSE,finalized,3,04/03/18 19:36,"""010""",0,0.673,"""111""",1,1,Tue Jun 11 11:57:18 +0000 2013,3.44E+17,riot police move into taksim square httpAddress,riot police move square,0.925914343,0.074085657,0318,698,1657979089,FALSE,finalized,3,04/03/18 19:03,"""nan""",0,0,"""000""",0,1,Wed Jun 12 23:46:34 +0000 2013,3.45E+17,usrId this is my second return two months on a roman dig in turkey afterwards !,second return two months roman dig afterwards,0.950754957,0.049245043,0319,702,1657979096,FALSE,finalized,3,04/04/18 09:27,"""010""",0,0.6658,"""111""",1,1,Mon Jun 17 10:46:06 +0000 2013,3.47E+17,icymi trying to quell protests turkish police uses belgian fn303 less lethal launchers httpAddress #occupygezi #taksim #turkey,icymi trying quell police uses belgian fn less lethal launchers,0.7742395,0.2257605,0320,703,1657979097,FALSE,finalized,3,4/21/2018 18:07:22,"""001""",0,0.6783,"""111""",1,1,Sun Jun 02 23:07:19 +0000 2013,3.41E+17,rt usrId stop the violence #occupygezi #occupyturkey httpAddress,stop violence occupyturkey,0.894500601,0.105499399,0321,706,1657979107,FALSE,finalized,3,04/09/18 14:10,"""0""",0,0,"""010""",0,0.6648,Tue Jun 04 00:48:52 +0000 2013,3.42E+17,rt usrId just had a long chat with my uni day classmate from httpAddress she seemed so excited about the taksim httpAddress,long chat uni day classmate seemed excited,0.962412677,0.037587323,0322,707,1657979109,FALSE,finalized,3,04/03/18 17:47,"""nan""",0,0,"""000""",0,1,Wed Jun 12 15:48:05 +0000 2013,3.45E+17,rt usrId follow our continued coverage of the situation in httpAddress photo taken by #fshotline user gorkem httpAddress httpAddress,follow continued coverage situation photo taken fshotline user gorkem,0.899030869,0.100969131,0323,709,1657979113,FALSE,finalized,3,04/03/18 22:05,"""nan""",0,0,"""000""",0,1,Sun Jun 16 15:46:13 +0000 2013,3.46E+17,#erdogan internat media does not see the massacres in syria the events in gaza ,erdogan internat media see massacres syria events gaza,0.987646695,0.012353305,0324,712,1657979119,FALSE,finalized,3,04/06/18 16:09,"""nan""",0,0,"""000""",0,1,Wed Jun 12 21:51:50 +0000 2013,3.45E+17,rt usrId thousands of anti government protesters remain in taksim sq tonight despite pm httpAddress what now for turkey ? our top story,thousands anti government remain sq tonight despite top story,0.963610868,0.036389132,0325,714,1657979123,FALSE,finalized,3,04/11/18 21:50,"""0""",0,0,"""010""",0,0.6667,Sat Jun 01 18:36:36 +0000 2013,3.41E+17,httpAddress now looping scene of protesters turning firefighters away from torched vehicle,looping scene turning firefighters away torched vehicle,0.948522129,0.051477871,0326,717,1657979131,FALSE,finalized,3,04/06/18 12:26,"""00""",0,0.6639,"""011""",1,0.6639,Mon Jun 03 20:38:52 +0000 2013,3.42E+17,just a little bit of what is going on in httpAddress #getthefacts #occupygezi #occupyistanbul httpAddress,little bit going getthefacts occupyistanbul,0.969868293,0.030131707,0327,718,1657979133,FALSE,finalized,3,04/07/18 17:04,"""nan""",0,0,"""000""",0,1,Tue Jun 11 07:20:18 +0000 2013,3.44E+17,rt usrId usrId usrId i m not sure what they mean about protesters giving an httpAddress httpAddress #,sure mean giving,0.948522129,0.051477871,0328,720,1657979138,FALSE,finalized,3,04/03/18 20:24,"""nan""",0,0,"""000""",0,1,Sun Jun 16 15:14:08 +0000 2013,3.46E+17,we love you turkish prime minister erdogan may allah protect you from the zionists,love prime minister erdogan allah protect zionists,0.992575473,0.007424527,0330,722,1657979140,FALSE,finalized,3,04/03/18 21:38,"""000""",0,1,"""111""",1,1,Fri May 31 15:54:43 +0000 2013,3.40E+17,thousands in #turkey are protesting construction of malls by demolishing existing httpAddress this is an excuse people r fed up by pm httpAddress,thousands protesting construction malls demolishing existing excuse people r fed,0.981825593,0.018174407,0331,723,1657979144,FALSE,finalized,3,4/14/2018 05:48:51,"""nan""",0,0,"""000""",0,1,Fri May 31 14:07:42 +0000 2013,3.40E+17,turkey burgers really can be juicy and flavorful httpAddress turkey burgers really can be juicy httpAddress httpAddress,burgers really juicy flavorful burgers really juicy,0.964349107,0.035650893,0332,724,1657979145,FALSE,finalized,3,04/03/18 18:07,"""nan""",0,0,"""000""",0,1,Fri Jun 21 21:25:33 +0000 2013,3.48E+17,rt usrId more urban women join the workforce in turkey httpAddress,urban women join workforce,0.964235847,0.035764153,0333,728,1657979151,FALSE,finalized,3,4/20/2018 13:22:17,"""nan""",0,0,"""000""",0,1,Wed Jun 12 17:12:09 +0000 2013,3.45E+17,leadership comparisons between erdogan thatcher and putin httpAddress,leadership comparisons erdogan thatcher putin,0.983331641,0.016668359,0334,729,1657979152,FALSE,finalized,3,4/20/2018 13:20:58,"""nan""",0,0,"""000""",0,1,Mon Jun 17 10:58:41 +0000 2013,3.47E+17,rt usrId shot my first turkey httpAddress . scared the shit out of everyone in the frozen food httpAddress,shot first scared shit everyone frozen food,0.951001691,0.048998309,0335,731,1657979154,FALSE,finalized,3,04/03/18 18:48,"""0""",0,0,"""001""",0,0.6594,Sun Jun 02 02:48:39 +0000 2013,3.41E+17,rt usrId imagine if 5 or even less of the protesters in #turkey were in #iran ? the media s bleeding hearts would be all over t,imagine even less iran media bleeding hearts would,0.952292308,0.047707692,0336,732,1657979156,FALSE,finalized,3,04/07/18 10:41,"""nan""",0,0,"""000""",0,1,Wed Jun 05 03:31:48 +0000 2013,3.42E+17,problem ? up brian turkey dog tho usrId this turkey dog good af,problem brian dog tho dog good af,0.949093483,0.050906517,0337,734,1657979158,FALSE,finalized,3,04/03/18 17:51,"""000""",0,1,"""111""",1,1,Sun Jun 09 21:03:04 +0000 2013,3.44E+17,protests show turks can t tolerate erdogan anymore aaron stein the atlantic httpAddress,show turks tolerate erdogan anymore aaron stein atlantic,0.983331641,0.016668359,0338,735,1657979162,FALSE,finalized,3,4/15/2018 14:57:56,"""111""",1,1,"""111""",1,1,Fri May 31 21:37:39 +0000 2013,3.41E+17,rt usrId in turkey at least DD injured as police clash with protesters at gezi park httpAddress #occupygezi httpAddress,least injured police clash,0.312386267,0.687613733,1339,785,1657979237,FALSE,finalized,3,4/22/2018 12:57:46,"""101""",1,0.6609,"""111""",1,1,Sat Jun 01 09:11:13 +0000 2013,3.41E+17,rt usrId usrId in turkey at least DD injured as police clash with protesters at gezi park httpAddress #occupygezi http,least injured police clash,0.312386267,0.687613733,1341,738,1657979167,FALSE,finalized,3,4/27/2018 17:18:44,"""000""",0,1,"""111""",1,1,Mon Jun 17 10:20:30 +0000 2013,3.47E+17,rt usrId turkey like an httpAddress layer after layer gezi park was an armenian cemetery and land before being confiscated by the stat,like layer layer armenian cemetery land confiscated stat,0.909140936,0.090859064,0342,739,1657979168,FALSE,finalized,3,04/03/18 19:00,"""nan""",0,0,"""000""",0,1,Sun Jun 02 06:09:31 +0000 2013,3.41E+17,iamsatellights just eatin a turkey sandwich i want panera meow,iamsatellights eatin sandwich want panera meow,0.949299345,0.050700655,0343,741,1657979172,FALSE,finalized,3,04/03/18 18:24,"""000""",0,1,"""111""",1,1,Sun Jun 09 20:49:15 +0000 2013,3.44E+17,turkish protesters call for continued demonstrations erdogan defiant haaretz httpAddress httpAddress usrId,call continued demonstrations erdogan defiant haaretz,0.951353057,0.048646943,0344,742,1657979174,FALSE,finalized,3,4/22/2018 18:46:35,"""0""",0,0,"""001""",0,0.6667,Mon Jun 24 12:40:32 +0000 2013,3.49E+17,rt usrId thousands of fenerbahce fans marching to taksim httpAddress httpAddress httpAddress,thousands fenerbahce fans marching,0.982589882,0.017410118,0345,747,1657979182,FALSE,finalized,3,04/03/18 22:25,"""nan""",0,0,"""000""",0,1,Fri Jun 07 18:57:33 +0000 2013,3.43E+17,within a common horizon at luxembourg amp ,within common horizon luxembourg,0.948522129,0.051477871,0346,748,1657979184,FALSE,finalized,3,04/03/18 21:04,"""000""",0,1,"""111""",1,1,Sat Jun 01 09:38:02 +0000 2013,3.41E+17,rt usrId a guide to whats going on in istanbuls gezi park httpAddress #gezipark #occupygezi #direngezipark,guide whats going istanbuls gezipark,0.99018132,0.00981868,0347,750,1657979187,FALSE,finalized,3,04/09/18 16:53,"""111""",1,1,"""111""",1,1,Fri May 31 19:03:22 +0000 2013,3.41E+17,usrId turkish police use excessive force to peaceful httpAddress #geziparki #direngaziparki please rt,police use excessive force peaceful direngaziparki please,0.66862652,0.33137348,1348,751,1657979189,FALSE,finalized,3,4/21/2018 18:13:48,"""000""",0,1,"""111""",1,1,Sun Jun 09 16:59:01 +0000 2013,3.44E+17,rt usrId this is what s happenning in istanbul right now #direngezipark #capulchulartakipleiyor httpAddress,happenning right capulchulartakipleiyor,0.978694303,0.021305697,0349,752,1657979190,FALSE,finalized,3,04/10/18 15:51,"""nan""",0,0,"""000""",0,1,Wed Jun 12 16:22:06 +0000 2013,3.45E+17,statement by hrvp catherine ashton on the latest developments in turkey httpAddress,statement hrvp catherine ashton latest developments,0.957137893,0.042862107,0351,758,1657979197,FALSE,finalized,3,4/22/2018 18:48:54,"""nan""",0,0,"""000""",0,1,Mon Jun 24 17:18:04 +0000 2013,3.49E+17,healed turkey vulture set free into the niagara gorge httpAddress,healed vulture set free niagara gorge,0.954551433,0.045448567,0352,759,1657979199,FALSE,finalized,3,4/14/2018 05:48:51,"""nan""",0,0,"""000""",0,1,Wed Jun 12 17:20:11 +0000 2013,3.45E+17,my sandwich just consisted of turkey ham sunny side up egg bacon pepper jack cheese and mango httpAddress if you were wanting to know,sandwich consisted ham sunny side egg bacon pepper jack cheese mango wanting know,0.970047646,0.029952354,0353,762,1657979202,FALSE,finalized,3,04/04/18 08:57,"""011""",1,0.6684,"""111""",1,1,Sun Jun 02 12:06:32 +0000 2013,3.41E+17,rt usrId usrId i am from turkey ! turkish that you take ! i love you so much ! turks 341163928736387072 sun jun DD 12 06 33 00 2013 #repost usrId what s going on in #turkey at the moment is a new page for us all in #history httpAddress jun DD 12 06 35 00 2013 rt usrId big clean up at gezi parki and the streets of httpAddress now returning to the festival atmosphere this whole protest star 341163949233942528 sun jun DD 12 06 38 00 2013 so jealous of my grandma in turkey right now ! 341163958981492736 sun jun DD 12 06 41 00 2013 rt usrId people of taksim trying to assist the dog who is also effected by the tear gas by the police httpAddress usrId jun DD 12 06 44 00 2013 rt usrId turkish protesters continue to gather at taksim square following withdrawal of heavy police presence httpAddress #o,take love much turks repost going moment new page us history big clean parki streets returning festival atmosphere whole star jealous grandma right people trying assist dog also effected tear gas police continue gather square following withdrawal heavy police presence o,0.648031646,0.351968354,1354,764,1657979205,FALSE,finalized,3,04/03/18 19:29,"""1""",0,0,"""100""",0,0.6667,Sun Jun 23 16:32:01 +0000 2013,3.49E+17,rt usrId crazy to think these streets were filled with clashes DD hours httpAddress now thescene of happy pride httpAddress #istanbul httpAddress,crazy think streets filled clashes hours thescene happy pride,0.918133149,0.081866851,0355,767,1657979210,FALSE,finalized,3,04/04/18 09:27,"""011""",1,0.6684,"""111""",1,1,Thu Jun 13 00:35:58 +0000 2013,3.45E+17,rt usrId turkey police attack to peaceful unable person at taksim square gezi httpAddress httpAddress via usrId #occupytu,police attack peaceful unable person square via occupytu,0.644557554,0.355442446,1356,771,1657979218,FALSE,finalized,3,04/03/18 18:43,"""000""",0,1,"""111""",1,1,Tue Jun 11 05:06:57 +0000 2013,3.44E+17,rt usrId riot police enter taksim square istanbul focus of ongoing anti government protest in turkey,riot police enter square focus ongoing anti government,0.921126905,0.078873095,0357,773,1657979221,FALSE,finalized,3,4/21/2018 18:05:25,"""0""",0,0,"""001""",0,0.6783,Sat Jun 08 19:53:13 +0000 2013,3.43E+17,rt usrId turkey protestors demands given a dose of reality by httpAddress the good the bad and the ridiculous httpAddress,protestors demands given dose reality good bad ridiculous,0.938951404,0.061048596,0358,774,1657979222,FALSE,finalized,3,04/03/18 21:15,"""00""",0,0.6658,"""101""",1,0.6658,Sat Jun 01 07:10:17 +0000 2013,3.41E+17,istanbul park protests sow the seeds of a turkish spring richard seymour httpAddress via usrId,sow seeds spring richard seymour via,0.948522129,0.051477871,0359,775,1657979223,FALSE,finalized,3,4/21/2018 17:58:30,"""0""",0,0,"""001""",0,0.6783,Mon Jun 03 12:01:15 +0000 2013,3.42E+17,rt usrId prime minister erdogan of #turkey can call usrId a menace but social media are now a political fact of httpAddress httpAddress,prime minister erdogan call menace social media political fact,0.989492557,0.010507443,0360,776,1657979224,FALSE,finalized,3,04/03/18 18:08,"""0""",0,0,"""001""",0,0.6594,Mon Jun 17 17:13:32 +0000 2013,3.47E+17,rt usrId meanwhile at a nearby restaurant toma turkish water cannon is on the menu #occupygezi #gezihumours httpAddress,meanwhile nearby restaurant toma water cannon menu gezihumours,0.851090557,0.148909443,0361,777,1657979225,FALSE,finalized,3,04/03/18 17:51,"""nan""",0,0,"""000""",0,1,Sat Jun 22 13:40:33 +0000 2013,3.48E+17,rt usrId cia and special operations troops have trained the rebels in anti tank and antiaircraft weaponry in jordan and turkey httpAddress,cia special operations troops trained rebels anti tank antiaircraft weaponry jordan,0.938336477,0.061663523,0