,Unnamed: 0,_unit_id,_golden,_unit_state_x,_trusted_judgments,_last_judgment_at_x,violence_judgment,violence,violence_confidence,protest_judgment_x,protest,protest_confidence,created_at,id,proccd_text,clean_text,non_vio_prob,vio_prob,violence_prediction362,779,1657979228,FALSE,finalized,3,04/04/18 09:01,"""0""",0,0,"""010""",0,0.6658,Mon Jun 24 21:05:37 +0000 2013,3.49E+17,eu seeks to look beyond turkey protests httpAddress,eu seeks look beyond,0.948522129,0.051477871,0363,781,1657979231,FALSE,finalized,3,04/06/18 15:57,"""000""",0,1,"""111""",1,1,Sat Jun 01 22:03:56 +0000 2013,3.41E+17,a revolution is httpAddress stay httpAddress spread the httpAddress #occupygezi #direngeziparki #occupyturkey httpAddress,revolution stay spread occupyturkey,0.79565181,0.20434819,0364,783,1657979233,FALSE,finalized,3,04/03/18 22:50,"""00""",0,0.6712,"""101""",1,0.6712,Thu Jun 13 20:32:49 +0000 2013,3.45E+17,rt usrId somehow bagpipes yep the scottish kind appeared on the httpAddress no idea how that httpAddress #occupygezi httpAddress,somehow bagpipes yep scottish kind appeared idea,0.948522129,0.051477871,0365,786,1657979239,FALSE,finalized,3,04/03/18 17:39,"""nan""",0,0,"""000""",0,1,Mon Jun 24 10:02:26 +0000 2013,3.49E+17,rt usrId #toilet history the roman flush toilet #travel #photo #turkey #offbeat #ttot httpAddress,toilet history roman flush toilet travel photo offbeat ttot,0.878453569,0.121546431,0366,788,1657979241,FALSE,finalized,3,04/03/18 22:17,"""0""",0,0,"""010""",0,0.6526,Fri Jun 14 09:37:27 +0000 2013,3.45E+17,a deeper look at erdogan s psych httpAddress by usrId #turkey #taksim,deeper look erdogan psych,0.983331641,0.016668359,0367,792,1657979247,FALSE,finalized,3,4/18/2018 05:40:22,"""nan""",0,0,"""000""",0,1,Sun Jun 16 16:12:28 +0000 2013,3.46E+17,#taksim #istanbul #turkey erdogan s ak supporters vested httpAddress the danger of politicalparties prevents democracy httpAddress,erdogan ak supporters vested danger politicalparties prevents democracy,0.986275782,0.013724218,0368,794,1657979249,FALSE,finalized,3,4/23/2018 09:30:58,"""001""",0,0.6783,"""111""",1,1,Mon Jun 03 00:26:34 +0000 2013,3.41E+17,government should respect the peaceful protesters and act to aleviate httpAddress we grieve for losses and injuries #occupygezi #occupyturkey,government respect peaceful act aleviate grieve losses injuries occupyturkey,0.939636878,0.060363122,0369,797,1657979252,FALSE,finalized,3,4/13/2018 06:57:17,"""000""",0,1,"""111""",1,1,Fri Jun 07 10:07:35 +0000 2013,3.43E+17,contours of a new republic and signals from the past how to understand taksim square httpAddress #occupygezi #direngezi,contours new republic signals past understand square direngezi,0.93298961,0.06701039,0370,798,1657979254,FALSE,finalized,3,04/07/18 17:14,"""nan""",0,0,"""000""",0,1,Sun Jun 02 18:40:14 +0000 2013,3.41E+17,rt usrId pm erdogan says it doesn t matter how much alcohol you consume one glass a week or more if you drink you are alcoh,erdogan says matter much alcohol consume one glass week drink alcoh,0.98727118,0.01272882,0371,801,1657979262,FALSE,finalized,3,04/03/18 21:48,"""000""",0,1,"""111""",1,1,Sat Jun 08 18:12:16 +0000 2013,3.43E+17,massive crowd #taksim sq . right httpAddress #live stream on httpAddress #occupyistanbul,massive crowd sq right live stream occupyistanbul,0.977979885,0.022020115,0372,804,1657979271,FALSE,finalized,3,04/07/18 15:28,"""000""",0,1,"""111""",1,1,Sat Jun 01 08:47:18 +0000 2013,3.41E+17,rt usrId erdogan s new flag of httpAddress #occupygezi #taksim #istanbul #direngaziparki httpAddress,erdogan new flag direngaziparki,0.989862678,0.010137322,0373,805,1657979272,FALSE,finalized,3,04/03/18 21:12,"""nan""",0,0,"""000""",0,1,Sun Jun 02 10:25:47 +0000 2013,3.41E+17,rt usrId turkey the world is watching the people of turkey you are not httpAddress,world watching people,0.982315428,0.017684572,0374,806,1657979273,FALSE,finalized,3,04/03/18 21:25,"""nan""",0,0,"""000""",0,1,Tue Jun 04 14:20:13 +0000 2013,3.42E+17,usrId #akp kicks people out of their home for runaway development projects and for the profit of akp httpAddress how is that freedom ?,akp kicks people home runaway development projects profit akp freedom,0.940790336,0.059209664,0375,808,1657979277,FALSE,finalized,3,04/03/18 18:49,"""101""",1,0.6612,"""111""",1,1,Sat Jun 15 20:36:51 +0000 2013,3.46E+17,rt usrId police kickin the person who is stuck under police vehicle ! tell to world turkish police killing people in taksim turkey ! usrId,police kickin person stuck police vehicle tell world police killing people,0.512504043,0.487495957,1376,809,1657979278,FALSE,finalized,3,4/23/2018 09:37:26,"""nan""",0,0,"""000""",0,1,Thu Jun 06 23:34:51 +0000 2013,3.43E+17,in DD the interest lobby launched a campaign against prime minister necmettin erbakan and provoked reaction of the httpAddress,interest lobby launched campaign prime minister necmettin erbakan provoked reaction,0.963908859,0.036091141,0377,812,1657979283,FALSE,finalized,3,04/03/18 19:24,"""010""",0,0.6748,"""111""",1,1,Fri May 31 16:57:06 +0000 2013,3.41E+17,rt usrId turkish police taking sd cards of protestor cameras #occupygezi #direngezipark httpAddress,police taking sd cards protestor cameras,0.835713926,0.164286074,0378,814,1657979285,FALSE,finalized,3,04/04/18 09:03,"""nan""",0,0,"""000""",0,1,Sun Jun 09 21:09:38 +0000 2013,3.44E+17,rt usrId turkey needs dialogue in order to develop its httpAddress eu expresses our httpAddress httpAddress,needs dialogue order develop eu expresses,0.954495046,0.045504954,0380,816,1657979287,FALSE,finalized,3,04/03/18 18:02,"""10""",0,0.3388,"""101""",1,0.6667,Sat Jun 15 22:20:32 +0000 2013,3.46E+17,that is like war meeh httpAddress meh dafuq what is this chemicals ? #occupygezi,like war meeh meh dafuq chemicals,0.697114123,0.302885877,0382,819,1657979292,FALSE,finalized,3,04/03/18 21:37,"""00""",0,0.6658,"""101""",1,0.6658,Fri Jun 14 09:17:56 +0000 2013,3.45E+17,turkey protests enter crucial phase httpAddress,enter crucial phase,0.975506092,0.024493908,0383,820,1657979295,FALSE,finalized,3,4/13/2018 06:16:58,"""010""",0,0.6667,"""111""",1,1,Sat Jun 01 08:53:11 +0000 2013,3.41E+17,bruce willis let everyone httpAddress in turkey is not httpAddress people dying on the streets ? turkey is suffering ! #dayangezipark,bruce willis let everyone people dying streets suffering dayangezipark,0.920300631,0.079699369,0384,821,1657979298,FALSE,finalized,3,4/15/2018 14:57:56,"""nan""",0,0,"""000""",0,1,Tue Jun 11 20:27:57 +0000 2013,3.45E+17,rt our correspondent has just returned from httpAddress uh what ?,correspondent returned uh,0.948522129,0.051477871,0385,822,1657979301,FALSE,finalized,3,04/06/18 15:40,"""0""",0,0,"""010""",0,0.6648,Sun Jun 16 10:43:25 +0000 2013,3.46E+17,rt usrId rt pls !! #direnankara akinunver police blocking the road to ethem s httpAddress tell D good reason for doing this httpAddress,pls akinunver police blocking road ethem tell d good reason,0.757850156,0.242149844,0387,825,1657979308,FALSE,finalized,3,04/04/18 08:50,"""nan""",0,0,"""000""",0,1,Sun Jun 09 22:49:48 +0000 2013,3.44E+17,rt usrId istanbul in photos the serpentine s new cloud cape town s hailstorm and more in our weekly look at the web httpAddress,photos serpentine new cloud cape town hailstorm weekly look web,0.922587771,0.077412229,0388,826,1657979310,FALSE,finalized,3,04/03/18 19:03,"""nan""",0,0,"""000""",0,1,Tue Jun 04 19:26:39 +0000 2013,3.42E+17,oopps spent way too much httpAddress well least me an usrId will be looking #reem in #turkey,oopps spent way much well least looking reem,0.948522129,0.051477871,0389,829,1657979316,FALSE,finalized,3,04/03/18 18:48,"""nan""",0,0,"""000""",0,1,Sat Jun 08 05:40:52 +0000 2013,3.43E+17,latvia v turkey volleyball european championships live stream june 09 DD httpAddress,latvia v volleyball european championships live stream june,0.9393191,0.0606809,0391,833,1657979324,FALSE,finalized,3,04/03/18 21:02,"""nan""",0,0,"""000""",0,1,Fri May 31 23:54:21 +0000 2013,3.41E+17,rt usrId D sheep jumped off a cliff in turkey amp ,d sheep jumped cliff,0.948522129,0.051477871,0393,836,1657979329,FALSE,finalized,3,04/03/18 19:15,"""nan""",0,0,"""000""",0,1,Thu Jun 20 19:31:11 +0000 2013,3.48E+17,final score italy turkey httpAddress sottana 11 ress 9 ,final score italy sottana ress,0.948522129,0.051477871,0394,839,1657979332,FALSE,finalized,3,04/03/18 21:44,"""nan""",0,0,"""000""",0,1,Wed Jun 05 12:44:40 +0000 2013,3.42E+17,towels imported from turkey and turkey imported from maaine,towels imported imported maaine,0.948522129,0.051477871,0395,840,1657979333,FALSE,finalized,3,04/07/18 16:46,"""nan""",0,0,"""000""",0,1,Sun Jun 23 18:31:44 +0000 2013,3.49E+17,erdogan defends riot police tactics in turkey protests istanbul reuters turkish prime minister tayyip httpAddress httpAddress,erdogan defends riot police tactics reuters prime minister tayyip,0.99199834,0.00800166,0396,841,1657979334,FALSE,finalized,3,04/03/18 21:44,"""000""",0,1,"""111""",1,1,Fri May 31 20:11:17 +0000 2013,3.41E+17,rt usrId crowd chants gov t resign in solidarity against fascism #istanbul #geziparki httpAddress,crowd chants gov resign solidarity fascism,0.975113649,0.024886351,0397,842,1657979337,FALSE,finalized,3,04/06/18 13:45,"""000""",0,1,"""111""",1,1,Sat Jun 08 23:45:47 +0000 2013,3.44E+17,from zero to half a billion good piece by usrId about usrId awfully nice person and usrId gt ,zero half billion good piece awfully nice person gt,0.949093483,0.050906517,0398,843,1657979338,FALSE,finalized,3,04/06/18 12:45,"""000""",0,1,"""111""",1,1,Tue Jun 11 11:13:13 +0000 2013,3.44E+17,women at the forefront of turkish protests we are the women erdogan would like to see staying at httpAddress httpAddress #occupygezi,women forefront women erdogan would like see staying,0.984752241,0.015247759,0399,846,1657979342,FALSE,finalized,3,04/03/18 22:39,"""nan""",0,0,"""000""",0,1,Mon Jun 10 12:31:31 +0000 2013,3.44E+17,DD days till turkey with my baby so motivated to get my sweat on tonight ! #sweatisjustfatcrying,days till baby motivated get sweat tonight sweatisjustfatcrying,0.977294392,0.022705608,0401,849,1657979348,FALSE,finalized,3,04/03/18 22:10,"""000""",0,1,"""111""",1,1,Thu Jun 06 20:38:49 +0000 2013,3.43E+17,rt usrId calling all cities of the world come out 8 9 june reclaim your public spaces to show #solidarity with #occupygezi http,calling cities world come june reclaim public spaces show solidarity,0.99006553,0.00993447,0403,854,1657979358,FALSE,finalized,3,4/23/2018 09:27:53,"""nan""",0,0,"""000""",0,1,Wed Jun 05 08:29:12 +0000 2013,3.42E+17,usrId i d rather be living in turkey where shit s going on than in england where it rains all the time,rather living shit going england rains time,0.992176246,0.007823754,0404,855,1657979360,FALSE,finalized,3,04/06/18 14:35,"""1""",0,0,"""010""",0,0.6639,Tue Jun 11 09:05:34 +0000 2013,3.44E+17,riot police clash with protesters in istanbul httpAddress,riot police clash,0.893617676,0.106382324,0405,857,1657979365,FALSE,finalized,3,04/03/18 21:25,"""111""",1,1,"""111""",1,1,Fri May 31 15:55:42 +0000 2013,3.40E+17,rt usrId zeynep erdim dim 5th day of #occupygezi #turkish police use extensive tear gas against protestors httpAddress,zeynep erdim dim th day police use extensive tear gas protestors,0.389572577,0.610427423,1406,858,1657979366,FALSE,finalized,3,04/04/18 09:07,"""010""",0,0.6658,"""111""",1,1,Sat Jun 01 08:25:56 +0000 2013,3.41E+17,rt usrId police hold #taksim under siege continue raid on 5th day of protests rocking #istanbul httpAddress,police hold siege continue raid th day rocking,0.848537277,0.151462723,0407,859,1657979368,FALSE,finalized,3,4/23/2018 09:35:09,"""1""",0,0,"""001""",0,0.6783,Sat Jun 15 20:15:19 +0000 2013,3.46E+17,rt usrId turkey is under attack by its own police ! 345997978655395841 sat jun DD 20 DD 21 00 2013 rt usrId people from gazi neighborhood predominantly alevite starting to marching towards httpAddress httpAddress #occu,attack police people gazi neighborhood predominantly alevite starting marching towards occu,0.778693342,0.221306658,0408,862,1657979372,FALSE,finalized,3,04/03/18 17:54,"""nan""",0,0,"""000""",0,1,Sun Jun 16 15:26:13 +0000 2013,3.46E+17,rt usrId i m very proud of #turkey and its achievement my god protect turkey its people and protect prime minster erdogan #istanbul,proud achievement god protect people protect prime minster erdogan,0.945574277,0.054425723,0409,864,1657979380,FALSE,finalized,3,04/07/18 16:21,"""nan""",0,0,"""000""",0,1,Sat Jun 08 20:14:59 +0000 2013,3.43E+17,rt usrId please broadcast police attacks on its own people in ankara !! it is happening right now !! usrId usrId usrId usrId,please broadcast police attacks people ankara happening right,0.811713493,0.188286507,0410,865,1657979381,FALSE,finalized,3,04/07/18 16:27,"""111""",1,1,"""111""",1,1,Tue Jun 11 06:29:07 +0000 2013,3.44E+17,rt usrId breaking turkish police control taksim sq repel protesters with tear gas httpAddress #occupyturkey #occupygezi,breaking police control sq repel tear gas occupyturkey,0.527479807,0.472520193,1411,867,1657979390,FALSE,finalized,3,04/06/18 12:09,"""00""",0,0.6702,"""101""",1,0.6702,Sun Jun 02 13:55:59 +0000 2013,3.41E+17,missed erdogan s remarks amp ,missed erdogan remarks,0.983331641,0.016668359,0412,874,1657979402,FALSE,finalized,3,4/22/2018 12:57:46,"""0""",0,0,"""001""",0,0.6783,Sun Jun 09 08:44:52 +0000 2013,3.44E+17,many thousands once again march against autocracy in httpAddress httpAddress,many thousands march autocracy,0.982589882,0.017410118,0413,877,1657979407,FALSE,finalized,3,04/03/18 21:02,"""100""",0,0.6612,"""111""",1,1,Sat Jun 01 07:33:27 +0000 2013,3.41E+17,rt usrId usrId please rt turkish government are killing us . turkish media on blackout #direngezipark httpAddress,please government killing us media blackout,0.936268392,0.063731608,0414,878,1657979408,FALSE,finalized,3,04/03/18 20:59,"""nan""",0,0,"""000""",0,1,Sun Jun 02 07:18:24 +0000 2013,3.41E+17,rt usrId on call out to istanbul thnks !! much good coverage of the critical httpAddress i cont httpAddress,call thnks much good coverage critical cont,0.949093483,0.050906517,0415,879,1657979409,FALSE,finalized,3,04/03/18 20:18,"""nan""",0,0,"""000""",0,1,Mon Jun 03 17:36:19 +0000 2013,3.42E+17,rt usrId went for nice swim previous today ! #turkey httpAddress,went nice swim previous today,0.976862559,0.023137441,0416,880,1657979411,FALSE,finalized,3,04/03/18 21:36,"""nan""",0,0,"""000""",0,1,Mon Jun 10 11:37:44 +0000 2013,3.44E+17,cyril ts usrId lol gazi it seems like they hve changed sunny park to sadton lol we missing out we need to go bck to pta rt cobo,cyril ts lol gazi seems like hve changed sunny sadton lol missing need go bck pta cobo,0.941931312,0.058068688,0417,881,1657979414,FALSE,finalized,3,4/22/2018 18:11:13,"""000""",0,1,"""111""",1,1,Tue Jun 04 09:06:37 +0000 2013,3.42E+17,rt usrId funeral for a friend this is where we lost abdullah cmert #occupygezi #occupyturkey httpAddress #rip httpAddress,funeral friend lost abdullah cmert occupyturkey rip,0.958727394,0.041272606,0418,883,1657979416,FALSE,finalized,3,4/27/2018 16:26:06,"""000""",0,1,"""111""",1,1,Wed Jun 05 21:50:41 +0000 2013,3.42E+17,DD bloggers arrested in #izmir httpAddress #occupygezi httpAddress via usrId #wearegezi,bloggers arrested izmir via wearegezi,0.986472542,0.013527458,0419,884,1657979418,FALSE,finalized,3,4/27/2018 16:26:06,"""nan""",0,0,"""000""",0,1,Tue Jun 11 10:01:38 +0000 2013,3.44E+17,mall project was last straw in httpAddress httpAddress be safe usrId,mall project last straw safe,0.948522129,0.051477871,0420,886,1657979425,FALSE,finalized,3,4/13/2018 07:01:04,"""000""",0,1,"""111""",1,1,Mon Jun 03 15:27:40 +0000 2013,3.42E+17,rt usrId turkish union to strike from tuesday over unrest httpAddress #occupygezi,union strike tuesday unrest,0.951015681,0.048984319,0422,888,1657979430,FALSE,finalized,3,04/06/18 12:02,"""01""",1,0.3398,"""110""",1,0.6659,Sat Jun 01 00:07:50 +0000 2013,3.41E+17,peaceful protest over istanbul park turns violent as police crack down httpAddress,peaceful turns violent police crack,0.385908909,0.614091091,1423,891,1657979435,FALSE,finalized,3,4/23/2018 09:30:58,"""001""",0,0.6783,"""111""",1,1,Sun Jun 02 07:02:20 +0000 2013,3.41E+17,rt usrId i wrote about #occupygezi for usrId it almost killed me . respect to all the real reporters out there ! httpAddress,wrote almost killed respect real reporters,0.701388276,0.298611724,0424,894,1657979439,FALSE,finalized,3,04/03/18 17:33,"""nan""",0,0,"""000""",0,1,Thu Jun 20 09:39:02 +0000 2013,3.48E+17,only a statesman can solve turkeys kurdish issue httpAddress #english #kurdistantribune kurd,statesman solve turkeys kurdish issue english kurdistantribune kurd,0.955611777,0.044388223,0425,897,1657979445,FALSE,finalized,3,04/03/18 18:07,"""111""",1,1,"""111""",1,1,Tue Jun 11 18:00:38 +0000 2013,3.45E+17,rt usrId after mayor s promise of no intervention the families even kids were at httpAddress all attacked by massive tear gas and fier,mayor promise intervention families even kids attacked massive tear gas fier,0.535879204,0.464120796,1426,900,1657979450,FALSE,finalized,3,4/22/2018 18:11:13,"""001""",0,0.6667,"""111""",1,1,Sat Jun 01 22:09:30 +0000 2013,3.41E+17,rt usrId rt usrId #tayipstifa #occupygezi more horrendous images from today #riseup httpAddress httpAddress,tayipstifa horrendous images today riseup,0.977382421,0.022617579,0427,902,1657979456,FALSE,finalized,3,04/03/18 21:55,"""nan""",0,0,"""000""",0,1,Wed Jun 12 17:42:46 +0000 2013,3.45E+17,news analysis turkey s history of military coups hangs over protests httpAddress,news analysis history military coups hangs,0.94788547,0.05211453,0428,906,1657979462,FALSE,finalized,3,04/03/18 19:31,"""nan""",0,0,"""000""",0,1,Sun Jun 09 13:02:54 +0000 2013,3.44E+17,i don t wanna revise i just wanna burn like a christmas turkey,wanna revise wanna burn like christmas,0.909140936,0.090859064,0429,911,1657979481,FALSE,finalized,3,04/03/18 22:16,"""nan""",0,0,"""000""",0,1,Wed Jun 05 15:56:44 +0000 2013,3.42E+17,pitcher of margaritas lunch httpAddress in restaurant acceptable but tequila shots lunch httpAddress sandwich in my house frowned upon,pitcher margaritas lunch restaurant acceptable tequila shots lunch sandwich house frowned upon,0.948522129,0.051477871,0430,912,1657979483,FALSE,finalized,3,04/07/18 16:39,"""nan""",0,0,"""000""",0,1,Sun Jun 02 23:23:09 +0000 2013,3.41E+17,rt usrId turkey has a httpAddress but not with islam httpAddress but a weak democratic culture that can t handle disagreement diffe,islam weak democratic culture handle disagreement diffe,0.948522129,0.051477871,0431,914,1657979485,FALSE,finalized,3,04/03/18 17:15,"""0""",0,0,"""001""",0,0.6612,Fri May 31 17:22:41 +0000 2013,3.41E+17,rt usrId sadly #turkey has become an ecological nightmare ,sadly become ecological nightmare,0.948522129,0.051477871,0432,919,1657979491,FALSE,finalized,3,04/07/18 08:54,"""nan""",0,0,"""000""",0,1,Sun Jun 02 00:29:33 +0000 2013,3.41E+17,protesters defiant as turkey unrest goes into third day reuters uk httpAddress #news,defiant unrest goes third day reuters uk news,0.979963929,0.020036071,0433,922,1657979495,FALSE,finalized,3,4/22/2018 18:26:55,"""00""",0,0.6667,"""110""",1,0.6667,Fri Jun 07 20:34:45 +0000 2013,3.43E+17,rt usrId a dream you dream alone is only a httpAddress a dream you dream together is httpAddress lennon #occupygezi #gezipark,dream dream alone dream dream together lennon gezipark,0.956448379,0.043551621,0434,925,1657979501,FALSE,finalized,3,04/07/18 17:12,"""111""",1,1,"""111""",1,1,Sat Jun 01 18:02:30 +0000 2013,3.41E+17,rt usrId police doesn t discern between demonstrators or spectators people in restaurents are being gassed #tayyipistifa #occupygezi,police discern demonstrators spectators people restaurents gassed tayyipistifa,0.605319331,0.394680669,1435,926,1657979502,FALSE,finalized,3,04/03/18 19:03,"""000""",0,1,"""111""",1,1,Sun Jun 16 12:39:45 +0000 2013,3.46E+17,hashtag #crazyerdogan says it all #occupygezi,hashtag crazyerdogan says,0.943243365,0.056756635,0437,932,1657979511,FALSE,finalized,3,04/03/18 18:03,"""10""",0,0.3406,"""101""",1,0.6676,Fri Jun 14 14:21:48 +0000 2013,3.46E+17,rt usrId who are they who carry clubs in their hands and attack ppl with police answer it via usrId #turkey #occupygezi,carry clubs hands attack ppl police answer via,0.824569874,0.175430126,0438,936,1657979516,FALSE,finalized,3,04/03/18 18:19,"""nan""",0,0,"""000""",0,1,Sun Jun 02 15:21:43 +0000 2013,3.41E+17,rt usrId httpAddress more powerful images from #turkey unrest via usrId httpAddress httpAddress httpAddress,powerful images unrest via,0.953758173,0.046241827,0439,940,1657979523,FALSE,finalized,3,04/07/18 17:10,"""111""",1,1,"""111""",1,1,Tue Jun 04 00:33:08 +0000 2013,3.42E+17,there are so many things going on in the world !! 341714DD9637816321 tue jun DD 00 33 15 00 2013 rt usrId usrId a DD year old has just been shot by a bullet and killed in turkey by the police ! help ! #direngeziparki #o 341714272818176001 tue jun DD 00 33 26 00 2013 akp bangtan boys release image teasers for jungkook jimin and jin httpAddress #bangtan #2cool4skool usrId usrId,many things going world year old shot bullet killed police help o akp bangtan boys release image teasers jungkook jimin jin bangtan cool skool,0.400991939,0.599008061,1441,944,1657979527,FALSE,finalized,3,04/03/18 18:42,"""000""",0,1,"""111""",1,1,Mon Jun 03 11:04:20 +0000 2013,3.42E+17,the voices of turkish protesters have been heard binnaz saktanber httpAddress via usrId #press #occupyturkey #occupygezi,voices heard binnaz saktanber via press occupyturkey,0.919044317,0.080955683,0442,947,1657979534,FALSE,finalized,3,4/21/2018 18:03:22,"""000""",0,1,"""111""",1,1,Sun Jun 09 10:34:28 +0000 2013,3.44E+17,these protesters taking #occupygezi memento pics httpAddress smily erdogan graffiti seem open to dialog httpAddress usrId,taking memento pics smily erdogan graffiti seem open dialog,0.97074826,0.02925174,0443,949,1657979537,FALSE,finalized,3,04/03/18 18:57,"""0""",0,0,"""001""",0,0.6594,Fri May 31 17:10:34 +0000 2013,3.41E+17,rt usrId hours after the clashes with protesters an istanbul court ruled in favor of a petition by a local advocacy httpAddress httpAddress,hours clashes court ruled favor petition local advocacy,0.96334476,0.03665524,0445,952,1657979543,FALSE,finalized,3,04/06/18 15:25,"""nan""",0,0,"""000""",0,1,Mon Jun 10 06:48:02 +0000 2013,3.44E+17,rt usrId #turkeys silent majority still supports #erdogan writes columnist usrId httpAddress,turkeys silent majority still supports erdogan writes columnist,0.9856654,0.0143346,0446,953,1657979545,FALSE,finalized,3,04/04/18 09:01,"""000""",0,1,"""111""",1,1,Wed Jun 12 23:42:16 +0000 2013,3.45E+17,rt usrId rt we call the citizens of turkey to taksim gezi park at D pm in order to claim their demands with us . #occupygezi #ta,call citizens d order claim demands us ta,0.930160831,0.069839169,0447,956,1657979550,FALSE,finalized,3,04/03/18 20:52,"""nan""",0,0,"""000""",0,1,Wed Jun 26 06:57:32 +0000 2013,3.50E+17,turkey is palestine somali httpAddress are gut but muslim is devil for you therefore we love erdogan #stoplyingcnn,palestine somali gut muslim devil therefore love erdogan stoplyingcnn,0.993453547,0.006546453,0448,959,1657979556,FALSE,finalized,3,04/06/18 16:09,"""nan""",0,0,"""000""",0,1,Sat Jun 15 22:10:09 +0000 2013,3.46E+17,usrId his and your announcements are crime against httpAddress stop telling httpAddress,announcements crime stop telling,0.948522129,0.051477871,0449,960,1657979559,FALSE,finalized,3,04/03/18 17:58,"""00""",0,0.6667,"""101""",1,0.6667,Sun Jun 02 12:20:24 +0000 2013,3.41E+17,#opturkey the #anonymous spring of turkey httpAddress,opturkey anonymous spring,0.936046861,0.063953139,0450,961,1657979561,FALSE,finalized,3,04/03/18 22:02,"""10""",0,0.3342,"""011""",1,0.6631,Sat Jun 08 15:08:20 +0000 2013,3.43E+17,rt usrId this is the most horrible account i read yet regarding police httpAddress sadly it sounds httpAddress httpAddress #occu,horrible account read yet regarding police sadly sounds occu,0.835713926,0.164286074,0451,963,1657979564,FALSE,finalized,3,04/07/18 16:21,"""nan""",0,0,"""000""",0,1,Tue Jun 18 05:38:18 +0000 2013,3.47E+17,usrId you call me a jive turkey again you ll be a fry boy till you die usrId,call jive fry boy till die,0.948522129,0.051477871,0452,964,1657979565,FALSE,finalized,3,04/03/18 19:10,"""nan""",0,0,"""000""",0,1,Tue Jun 04 17:05:36 +0000 2013,3.42E+17,wrap turkey slices around colorful bell pepper sticks for an energy boosting afternoon httpAddress #yum !,wrap slices around colorful bell pepper sticks energy boosting afternoon yum,0.961996233,0.038003767,0453,967,1657979574,FALSE,finalized,3,04/04/18 09:21,"""nan""",0,0,"""000""",0,1,Sun Jun 16 20:13:50 +0000 2013,3.46E+17,ahh turkey tomorrow while all you are sitting in school ! have fun fuckers !,ahh tomorrow sitting school fun fuckers,0.948522129,0.051477871,0454,968,1657979575,FALSE,finalized,3,04/06/18 12:30,"""nan""",0,0,"""000""",0,1,Sat Jun 08 16:06:36 +0000 2013,3.43E+17,usrId i want go turkey nice to meet u,want go nice meet u,0.952851001,0.047148999,0455,969,1657979577,FALSE,finalized,3,04/03/18 21:47,"""nan""",0,0,"""000""",0,1,Sun Jun 02 12:26:59 +0000 2013,3.41E+17,rt usrId we hope our friends in turkey stay safe are free to express their dreams hopes fears in a peaceful way without being at,hope friends stay safe free express dreams hopes fears peaceful way without,0.907247435,0.092752565,0456,970,1657979578,FALSE,finalized,3,04/03/18 18:49,"""nan""",0,0,"""000""",0,1,Thu Jun 20 18:15:44 +0000 2013,3.48E+17,chatham house expert comment #turkey confrontational politics is no httpAddress httpAddress,chatham house expert comment confrontational politics,0.948522129,0.051477871,0