,clean_text,non_vio_prob,vio_prob,violence_prediction
679,halktv candir direngaziparki,0.8923167362700648,0.10768326372993524,0.0
43,think last pic managed see gas cloud landing middle crowded,0.7493190947771349,0.25068090522286496,0.0
691,cnn international correspondent covering growing cnn turk showing music videos,0.6876752581002955,0.3123247418997045,0.0
735,least injured police clash,0.7418352529155344,0.2581647470844654,0.0
1281,dictator erdogan blames twitter unrest coward wearegezi occupyturkey,0.9779365359545467,0.02206346404545346,0.0
1217,overwhelm police march weilding polis shields one painted anarchy symbol o,0.7816083411003856,0.21839165889961437,0.0
645,erdogan speech sounds almost absurdly provocative combative towards scary oc,0.9434848207969948,0.05651517920300515,0.0
767,police attack peaceful unable person square via occupytu,0.461981215154313,0.538018784845687,1.0
133,direngaziparki things happening open browser,0.8865215554921753,0.11347844450782463,0.0
135,despite attack continue post updates bradley manning trial,0.9365044671000466,0.06349553289995337,0.0
1263,earlier tonight intercontinental opens doors,0.9510168815168831,0.0489831184831169,0.0
1208,riots barricades street battles police fight photos video direngezip,0.8712093331172542,0.12879066688274587,0.0
19,solidarity though regime learn neighbors mideast,0.9031528740635981,0.09684712593640186,0.0
935,turkeys take musical break,0.8923167362700648,0.10768326372993524,0.0
265,stanbul foggy tear gas,0.6427341094166513,0.35726589058334873,1.0
529,took mt amazing picture man wearing gas mask top ataturk cultural center,0.8232435142145136,0.17675648578548642,0.0
599,people crossing bridge support protesting direngezipaki,0.9112568859789781,0.08874311402102208,0.0
699,images direngezi,0.8489409203474848,0.1510590796525149,0.0
62,whole world watching peoples government watch people learn resist,0.9190097450656407,0.08099025493435946,0.0
807,defending police attacks,0.7088860113050729,0.29111398869492716,0.0
1209,police using water cannons push people tear gas fired well tension esca,0.11424533473228062,0.8857546652677193,1.0
609,words v please see occupytaksim,0.8923167362700648,0.10768326372993524,0.0
1186,turkeys ak party rules early polls mass renew via akp,0.8938234665364415,0.10617653346355853,0.0
635,spring already needs liberal participatory,0.9011043715286994,0.09889562847130046,0.0
546,believe way people believe fairy direngezi,0.6704072273671644,0.32959277263283565,0.0
591,photo protester injured demonstartion ankara,0.48769182989396326,0.5123081701060367,1.0
534,show support peaceful hope excessive violence police ends di,0.6724000339972719,0.327599966002728,0.0
1105,latest bbc report sunday night saw worst violence cover,0.8368627685666342,0.16313723143336592,0.0
577,harbiye near people report police driving vehicles,0.6663403258383526,0.3336596741616475,0.0
980,fiercest anti gov riots years erupt,0.9213446871220466,0.07865531287795327,0.0
84,commented young urban women face,0.8923167362700648,0.10768326372993524,0.0
925,police discern demonstrators spectators people restaurents gassed tayyipistifa,0.9220877112297653,0.07791228877023461,0.0
848,oracle bob evans cloudexpo session standing room cloud,0.8601578800465329,0.13984211995346696,0.0
1145,average day,0.87658142871634,0.12341857128366013,0.0
779,eu seeks look beyond,0.8166995146632638,0.18330048533673618,0.0
124,video police brutally disperse demolition,0.8023303100268718,0.19766968997312812,0.0
1138,police attack istanbuls square occupytaksim,0.7613237636055353,0.23867623639446467,0.0
793,meanwhile revolution televised,0.8598531864990651,0.14014681350093497,0.0
314,old man lost ear police allow ambulance move,0.682818417111464,0.3171815828885361,0.0
184,ran tank square,0.8821956268870984,0.11780437311290184,0.0
667,imported tons tear gas million pepper spray years mainly us brazil,0.7004830584239504,0.2995169415760496,0.0
521,mothers gezipark mothers police draw back sons,0.6232219963738019,0.3767780036261982,1.0
1182,time get pitchforks n torches march parliament screamin peaceful,0.8788317011344692,0.12116829886553075,0.0
203,support fans protesting government right tayyipi sikeyim turke,0.9668008771699952,0.033199122830004764,0.0
1152,whirling dervish ready gas earlier today,0.8152267907917553,0.1847732092082446,0.0
999,photo racyagainsttheclock peoples library,0.8408192665605115,0.1591807334394885,0.0
11,police crush ankara photos video,0.8746204622496442,0.12537953775035568,0.0
74,gallery clashes intensify,0.8688715043678619,0.13112849563213816,0.0
1229,ntv broadcast programme package press freedom,0.8408214315199315,0.15917856848006828,0.0
973,d week gezipark food,0.7938261466668172,0.20617385333318258,0.0
122,announcement plz responsive cansel years old girl lost family stage plz help,0.5467627950829176,0.45323720491708225,1.0
189,killererdogan resistanbul another chemical used water canons,0.5465673816350082,0.4534326183649917,1.0
364,guess contract develop brutally tear gassed woman red symbol occupy,0.8360061100564922,0.16399388994350786,0.0
1203,supporting must champion human rights,0.9157298315638188,0.08427016843618124,0.0
1095,footage one greenpeace ping,0.8923167362700648,0.10768326372993524,0.0
772,tv channel hayat tv shut bcz broadcasting,0.866851907890479,0.13314809210952125,0.0
402,peoplepower iman nl hi world real revolution looks like right direngezi,0.8725150109771663,0.1274849890228338,0.0
638,oh vitamins governor says put medicine chemicals sprayed occupyg,0.8720026466664561,0.1279973533335438,0.0
246,mayor says shopping mall built military barracks project continue,0.805553189658343,0.1944468103416572,0.0
736,chaos overtakes tear gas water cannons fireworks details live tv,0.34164054495979845,0.6583594550402012,1.0
492,economy,0.8923167362700648,0.10768326372993524,0.0
627,taken friend tunel god theboy noticed barely time startedrunning,0.9431792712945711,0.05682072870542886,0.0
260,d canadian journalists detained people daily online,0.8639455757826315,0.13605442421736855,0.0
1295,gezipark,0.7938261466668172,0.20617385333318258,0.0
643,people fighting read report friend sq,0.8738970721179213,0.1261029278820788,0.0
710,birgn article english thanks free news world art design bit art school relevance wsa erdogan wounded felled reuters dazedmagazine riots continue cause uproar trafalgar square hosts version,0.9348583501755703,0.06514164982442962,0.0
1297,carries wounded policeman gkhnbykl,0.8923167362700648,0.10768326372993524,0.0
737,love smell teargas,0.9164842242465323,0.08351577575346773,0.0
179,shame first page today going,0.9343312421946709,0.06566875780532913,0.0
167,one,0.8923167362700648,0.10768326372993524,0.0
3,erdogan says vandals entering mosques beer bottles attacking women headscarves,0.9202593992055859,0.07974060079441424,0.0
602,citizens protesting get taste govts brutality chance christians minorities,0.9201588287369333,0.07984117126306671,0.0
610,governor says police would target sit square,0.6815525483020921,0.31844745169790767,0.0
123,proof police violence,0.5822882045332071,0.4177117954667929,1.0
429,d killed far via,0.860820108082602,0.13917989191739816,0.0
1043,stop calling small green space,0.879315824761673,0.12068417523832708,0.0
619,dress protect teargas photos live blog,0.9219003835323396,0.07809961646766048,0.0
465,terrorist job right,0.9454855763078244,0.05451442369217562,0.0
976,turkeys prime minister says riots caused menace called twitter t,0.8759605128332013,0.12403948716679886,0.0
922,dream dream alone dream dream together lennon gezipark,0.7938261466668172,0.20617385333318258,0.0
1215,received message,0.9113110812813905,0.08868891871860937,0.0
1275,watch video opturkey via,0.9012696238302794,0.09873037616972047,0.0
1192,wsj survey half never taken part mass demonstration n u,0.8923167362700648,0.10768326372993524,0.0
1280,night falls tensions rising stay tuned latest,0.9079196960181037,0.09208030398189634,0.0
1067,continuing spreading world los occupyturkey,0.9315181872986619,0.06848181270133796,0.0
102,woman red image girl sprayed tear gas police becomes symbol violent,0.18066204575697753,0.8193379542430224,1.0
510,deputy seeks calm anti government reuters deputy prime,0.932786887496061,0.06721311250393895,0.0
613,protester dresses police stealing helmet shield baton security forces umit bektas,0.5434733109420994,0.4565266890579006,1.0
403,tens thousands people attempting cross asia europe across bosphorus bridge many ferry crossing,0.7885959584551848,0.21140404154481485,0.0
116,berlin solidarity youth,0.9031528740635981,0.09684712593640186,0.0
1305,football fans call resign,0.8923167362700648,0.10768326372993524,0.0
1285,engulfed across several cities riot police turned battleground,0.7777362485638082,0.22226375143619173,0.0
815,child overcome tear gas hotel near photo yannis,0.5695485870873369,0.43045141291266303,1.0
1098,dont occupy defendturkey,0.8756968326220154,0.12430316737798475,0.0
669,spread violence demolition ocuppygezi,0.8796772743423767,0.12032272565762321,0.0
351,erdogan seek permission hoodlums implement plans,0.9434848207969948,0.05651517920300515,0.0
1084,square activists entered police ankara police using chemical,0.13719585668844136,0.8628041433115589,1.0
788,deeper look erdogan psych,0.8884016542614336,0.11159834573856621,0.0
753,erdoan shame utanc resmi,0.9337460830172638,0.06625391698273606,0.0
1039,events occured yesterday horrifying sad televised bc,0.8923167362700648,0.10768326372993524,0.0
1278,reports people marching towards parliament building ankara,0.8270663775893186,0.17293362241068155,0.0
690,needs confirmation ankara one police used gun shot citizen,0.2656910851024942,0.7343089148975058,1.0
1146,morning throwers protestors,0.9450941632785377,0.05490583672146232,0.0
1178,blog situation mediafreedom,0.8923167362700648,0.10768326372993524,0.0
954,help syria n rebels d d salam peace picture holiday good night d daily images d blog archive alysaa miller harper bazaar daily images d partly sums protestsinturkey d d slowly dark heavily draped curtains direnturkiye,0.44760296056389115,0.552397039436109,1.0
481,situation front divan hotel calmed still enough medics police closed streets stopped,0.9167493701271265,0.08325062987287356,0.0
1137,must see video first week,0.903826814518279,0.09617318548172099,0.0
347,looking erdogan attacking peaceful one imagine ak would done flotilla would invaded waters,0.8794206662748234,0.12057933372517687,0.0
684,frightening photos police violence occupytaksim,0.6802519402886027,0.31974805971139714,0.0
132,solidarity people fuck police,0.6952578299780646,0.3047421700219352,0.0
32,whoever thought piano concert tensions diffused back,0.8923167362700648,0.10768326372993524,0.0
81,riot police storm square nbb,0.7597455304754899,0.24025446952451,0.0
811,good analysis context,0.8598562556188571,0.14014374438114288,0.0
1055,people started write,0.8243710669446168,0.17562893305538313,0.0
928,police launch crackdown hours erdogan gave final warning,0.8145837816657496,0.18541621833425015,0.0
355,correct information english solidarity pay attention announcements made via account,0.9031528740635981,0.09684712593640186,0.0
1243,reports people soldiers giving masks attacked tear gas,0.44869289950262603,0.551307100497374,1.0
830,well might one powerful images whirling dervish gas mask,0.7493190947771349,0.25068090522286496,0.0
738,like layer layer armenian cemetery land confiscated stat,0.8601578800465329,0.13984211995346696,0.0
36,photographs police using tear gas water cannon disperse,0.31113296118531264,0.6888670388146875,1.0
1246,sesvertrkiyebulkesahipsizdeil become subject saving,0.8923167362700648,0.10768326372993524,0.0
594,government threatens pressurized behalf democracy usa amnesty,0.8756205383077312,0.1243794616922689,0.0
399,thousands gathering square fourth night anti government demonstrations indis,0.8714922880974111,0.12850771190258897,0.0
877,please government killing us media blackout,0.8475862054769625,0.15241379452303755,0.0
1009,invisible war waged dare stand speak resistanbul,0.7271455442109266,0.27285445578907347,0.0
687,media savvy crowdfunding statement,0.8408388457017686,0.15916115429823172,0.0
342,alone solidarity via nyxxisnite,0.9031528740635981,0.09684712593640186,0.0
103,video j barricades reinforced anticipation attack camp istranbul,0.7782302368765321,0.22176976312346788,0.0
1085,cnn turk,0.8317658535808352,0.16823414641916476,0.0
44,spartacus arrived gezipark via,0.7938261466668172,0.20617385333318258,0.0
907,look eerily familiar residents canadian via,0.7908999058046474,0.2091000941953525,0.0
813,greenpeace joins peaceful solidarity protect right peaceful,0.7191784105932661,0.2808215894067339,0.0
500,challenge accepted call d million people gather erdogan threatened dmilyonyarintaksime,0.9080795244908663,0.09192047550913351,0.0
1117,best luck people occupyturkey,0.8452101643295329,0.1547898356704673,0.0
1068,government destroy middle police attack htt,0.7352915846437897,0.26470841535621015,0.0
1194,really hope erdogan akp paying democracy theocracy di,0.9346383898033661,0.06536161019663388,0.0
702,icymi trying quell police uses belgian fn less lethal launchers,0.7816083411003856,0.21839165889961437,0.0
585,good read erdoan shot foot via,0.9390489844085147,0.06095101559148523,0.0
1011,revolution televised,0.8598531864990651,0.14014681350093497,0.0
226,place time via,0.9431792712945711,0.05682072870542886,0.0
929,dear government treats occupyturkey via,0.8648309743507029,0.13516902564929723,0.0
537,amnesty internationals issuing international call activists take action police violence direngezi,0.413522631047087,0.5864773689529131,1.0
412,minor earthquake western june important earthquake data magnitude local time,0.9410929814883515,0.058907018511648424,0.0
668,right dozens injuried kizillay via,0.9286358024743497,0.07136419752565026,0.0
